{
  "schema_version": "1.0",
  "event_id": "31d6dfee-8b3f-4c95-a296-b1fc6f36fe20",
  "event_type": "forecast.verification.requested.v1",
  "occurred_at": "2026-08-30T08:05:00Z",
  "run_id": "dc2d64bd-cf78-4d74-ad6b-b34716ba098c",
  "job_id": "ed1e495e-a213-4c4f-930f-bca7d386641c",
  "trace_id": "fb4dc6a8-b421-4543-aa3b-ac6a30925d6f",
  "payload": {
    "forecast_uri": "s3://rainpulse/products/dc2d64bd-cf78-4d74-ad6b-b34716ba098c/pysteps-lk/forecast.zarr",
    "forecast_sha256": "aaaaaaaaaaaaaaaaaaaaaaaaaaaaaaaaaaaaaaaaaaaaaaaaaaaaaaaaaaaaaaaa",
    "truth_frames": [
      {
        "analysis_id": "00000000-0000-4000-8000-000000000006",
        "valid_time": "2026-08-30T08:06:00Z",
        "input_uri": "s3://rainpulse/analysis/fuzhou/2026/08/30/0806/analysis.zarr",
        "input_sha256": "bbbbbbbbbbbbbbbbbbbbbbbbbbbbbbbbbbbbbbbbbbbbbbbbbbbbbbbbbbbbbbbb"
      },
      {
        "analysis_id": "00000000-0000-4000-8000-000000000012",
        "valid_time": "2026-08-30T08:12:00Z",
        "input_uri": "s3://rainpulse/analysis/fuzhou/2026/08/30/0812/analysis.zarr",
        "input_sha256": "bbbbbbbbbbbbbbbbbbbbbbbbbbbbbbbbbbbbbbbbbbbbbbbbbbbbbbbbbbbbbbbb"
      },
      {
        "analysis_id": "00000000-0000-4000-8000-000000000018",
        "valid_time": "2026-08-30T08:18:00Z",
        "input_uri": "s3://rainpulse/analysis/fuzhou/2026/08/30/0818/analysis.zarr",
        "input_sha256": "bbbbbbbbbbbbbbbbbbbbbbbbbbbbbbbbbbbbbbbbbbbbbbbbbbbbbbbbbbbbbbbb"
      },
      {
        "analysis_id": "00000000-0000-4000-8000-000000000024",
        "valid_time": "2026-08-30T08:24:00Z",
        "input_uri": "s3://rainpulse/analysis/fuzhou/2026/08/30/0824/analysis.zarr",
        "input_sha256": "bbbbbbbbbbbbbbbbbbbbbbbbbbbbbbbbbbbbbbbbbbbbbbbbbbbbbbbbbbbbbbbb"
      },
      {
        "analysis_id": "00000000-0000-4000-8000-000000000030",
        "valid_time": "2026-08-30T08:30:00Z",
        "input_uri": "s3://rainpulse/analysis/fuzhou/2026/08/30/0830/analysis.zarr",
        "input_sha256": "bbbbbbbbbbbbbbbbbbbbbbbbbbbbbbbbbbbbbbbbbbbbbbbbbbbbbbbbbbbbbbbb"
      },
      {
        "analysis_id": "00000000-0000-4000-8000-000000000036",
        "valid_time": "2026-08-30T08:36:00Z",
        "input_uri": "s3://rainpulse/analysis/fuzhou/2026/08/30/0836/analysis.zarr",
        "input_sha256": "bbbbbbbbbbbbbbbbbbbbbbbbbbbbbbbbbbbbbbbbbbbbbbbbbbbbbbbbbbbbbbbb"
      },
      {
        "analysis_id": "00000000-0000-4000-8000-000000000042",
        "valid_time": "2026-08-30T08:42:00Z",
        "input_uri": "s3://rainpulse/analysis/fuzhou/2026/08/30/0842/analysis.zarr",
        "input_sha256": "bbbbbbbbbbbbbbbbbbbbbbbbbbbbbbbbbbbbbbbbbbbbbbbbbbbbbbbbbbbbbbbb"
      },
      {
        "analysis_id": "00000000-0000-4000-8000-000000000048",
        "valid_time": "2026-08-30T08:48:00Z",
        "input_uri": "s3://rainpulse/analysis/fuzhou/2026/08/30/0848/analysis.zarr",
        "input_sha256": "bbbbbbbbbbbbbbbbbbbbbbbbbbbbbbbbbbbbbbbbbbbbbbbbbbbbbbbbbbbbbbbb"
      },
      {
        "analysis_id": "00000000-0000-4000-8000-000000000054",
        "valid_time": "2026-08-30T08:54:00Z",
        "input_uri": "s3://rainpulse/analysis/fuzhou/2026/08/30/0854/analysis.zarr",
        "input_sha256": "bbbbbbbbbbbbbbbbbbbbbbbbbbbbbbbbbbbbbbbbbbbbbbbbbbbbbbbbbbbbbbbb"
      },
      {
        "analysis_id": "00000000-0000-4000-8000-000000000060",
        "valid_time": "2026-08-30T09:00:00Z",
        "input_uri": "s3://rainpulse/analysis/fuzhou/2026/08/30/0900/analysis.zarr",
        "input_sha256": "bbbbbbbbbbbbbbbbbbbbbbbbbbbbbbbbbbbbbbbbbbbbbbbbbbbbbbbbbbbbbbbb"
      },
      {
        "analysis_id": "00000000-0000-4000-8000-000000000066",
        "valid_time": "2026-08-30T09:06:00Z",
        "input_uri": "s3://rainpulse/analysis/fuzhou/2026/08/30/0906/analysis.zarr",
        "input_sha256": "bbbbbbbbbbbbbbbbbbbbbbbbbbbbbbbbbbbbbbbbbbbbbbbbbbbbbbbbbbbbbbbb"
      },
      {
        "analysis_id": "00000000-0000-4000-8000-000000000072",
        "valid_time": "2026-08-30T09:12:00Z",
        "input_uri": "s3://rainpulse/analysis/fuzhou/2026/08/30/0912/analysis.zarr",
        "input_sha256": "bbbbbbbbbbbbbbbbbbbbbbbbbbbbbbbbbbbbbbbbbbbbbbbbbbbbbbbbbbbbbbbb"
      },
      {
        "analysis_id": "00000000-0000-4000-8000-000000000078",
        "valid_time": "2026-08-30T09:18:00Z",
        "input_uri": "s3://rainpulse/analysis/fuzhou/2026/08/30/0918/analysis.zarr",
        "input_sha256": "bbbbbbbbbbbbbbbbbbbbbbbbbbbbbbbbbbbbbbbbbbbbbbbbbbbbbbbbbbbbbbbb"
      },
      {
        "analysis_id": "00000000-0000-4000-8000-000000000084",
        "valid_time": "2026-08-30T09:24:00Z",
        "input_uri": "s3://rainpulse/analysis/fuzhou/2026/08/30/0924/analysis.zarr",
        "input_sha256": "bbbbbbbbbbbbbbbbbbbbbbbbbbbbbbbbbbbbbbbbbbbbbbbbbbbbbbbbbbbbbbbb"
      },
      {
        "analysis_id": "00000000-0000-4000-8000-000000000090",
        "valid_time": "2026-08-30T09:30:00Z",
        "input_uri": "s3://rainpulse/analysis/fuzhou/2026/08/30/0930/analysis.zarr",
        "input_sha256": "bbbbbbbbbbbbbbbbbbbbbbbbbbbbbbbbbbbbbbbbbbbbbbbbbbbbbbbbbbbbbbbb"
      },
      {
        "analysis_id": "00000000-0000-4000-8000-000000000096",
        "valid_time": "2026-08-30T09:36:00Z",
        "input_uri": "s3://rainpulse/analysis/fuzhou/2026/08/30/0936/analysis.zarr",
        "input_sha256": "bbbbbbbbbbbbbbbbbbbbbbbbbbbbbbbbbbbbbbbbbbbbbbbbbbbbbbbbbbbbbbbb"
      },
      {
        "analysis_id": "00000000-0000-4000-8000-000000000102",
        "valid_time": "2026-08-30T09:42:00Z",
        "input_uri": "s3://rainpulse/analysis/fuzhou/2026/08/30/0942/analysis.zarr",
        "input_sha256": "bbbbbbbbbbbbbbbbbbbbbbbbbbbbbbbbbbbbbbbbbbbbbbbbbbbbbbbbbbbbbbbb"
      },
      {
        "analysis_id": "00000000-0000-4000-8000-000000000108",
        "valid_time": "2026-08-30T09:48:00Z",
        "input_uri": "s3://rainpulse/analysis/fuzhou/2026/08/30/0948/analysis.zarr",
        "input_sha256": "bbbbbbbbbbbbbbbbbbbbbbbbbbbbbbbbbbbbbbbbbbbbbbbbbbbbbbbbbbbbbbbb"
      },
      {
        "analysis_id": "00000000-0000-4000-8000-000000000114",
        "valid_time": "2026-08-30T09:54:00Z",
        "input_uri": "s3://rainpulse/analysis/fuzhou/2026/08/30/0954/analysis.zarr",
        "input_sha256": "bbbbbbbbbbbbbbbbbbbbbbbbbbbbbbbbbbbbbbbbbbbbbbbbbbbbbbbbbbbbbbbb"
      },
      {
        "analysis_id": "00000000-0000-4000-8000-000000000120",
        "valid_time": "2026-08-30T10:00:00Z",
        "input_uri": "s3://rainpulse/analysis/fuzhou/2026/08/30/1000/analysis.zarr",
        "input_sha256": "bbbbbbbbbbbbbbbbbbbbbbbbbbbbbbbbbbbbbbbbbbbbbbbbbbbbbbbbbbbbbbbb"
      },
      {
        "analysis_id": "00000000-0000-4000-8000-000000000126",
        "valid_time": "2026-08-30T10:06:00Z",
        "input_uri": "s3://rainpulse/analysis/fuzhou/2026/08/30/1006/analysis.zarr",
        "input_sha256": "bbbbbbbbbbbbbbbbbbbbbbbbbbbbbbbbbbbbbbbbbbbbbbbbbbbbbbbbbbbbbbbb"
      },
      {
        "analysis_id": "00000000-0000-4000-8000-000000000132",
        "valid_time": "2026-08-30T10:12:00Z",
        "input_uri": "s3://rainpulse/analysis/fuzhou/2026/08/30/1012/analysis.zarr",
        "input_sha256": "bbbbbbbbbbbbbbbbbbbbbbbbbbbbbbbbbbbbbbbbbbbbbbbbbbbbbbbbbbbbbbbb"
      },
      {
        "analysis_id": "00000000-0000-4000-8000-000000000138",
        "valid_time": "2026-08-30T10:18:00Z",
        "input_uri": "s3://rainpulse/analysis/fuzhou/2026/08/30/1018/analysis.zarr",
        "input_sha256": "bbbbbbbbbbbbbbbbbbbbbbbbbbbbbbbbbbbbbbbbbbbbbbbbbbbbbbbbbbbbbbbb"
      },
      {
        "analysis_id": "00000000-0000-4000-8000-000000000144",
        "valid_time": "2026-08-30T10:24:00Z",
        "input_uri": "s3://rainpulse/analysis/fuzhou/2026/08/30/1024/analysis.zarr",
        "input_sha256": "bbbbbbbbbbbbbbbbbbbbbbbbbbbbbbbbbbbbbbbbbbbbbbbbbbbbbbbbbbbbbbbb"
      },
      {
        "analysis_id": "00000000-0000-4000-8000-000000000150",
        "valid_time": "2026-08-30T10:30:00Z",
        "input_uri": "s3://rainpulse/analysis/fuzhou/2026/08/30/1030/analysis.zarr",
        "input_sha256": "bbbbbbbbbbbbbbbbbbbbbbbbbbbbbbbbbbbbbbbbbbbbbbbbbbbbbbbbbbbbbbbb"
      },
      {
        "analysis_id": "00000000-0000-4000-8000-000000000156",
        "valid_time": "2026-08-30T10:36:00Z",
        "input_uri": "s3://rainpulse/analysis/fuzhou/2026/08/30/1036/analysis.zarr",
        "input_sha256": "bbbbbbbbbbbbbbbbbbbbbbbbbbbbbbbbbbbbbbbbbbbbbbbbbbbbbbbbbbbbbbbb"
      },
      {
        "analysis_id": "00000000-0000-4000-8000-000000000162",
        "valid_time": "2026-08-30T10:42:00Z",
        "input_uri": "s3://rainpulse/analysis/fuzhou/2026/08/30/1042/analysis.zarr",
        "input_sha256": "bbbbbbbbbbbbbbbbbbbbbbbbbbbbbbbbbbbbbbbbbbbbbbbbbbbbbbbbbbbbbbbb"
      },
      {
        "analysis_id": "00000000-0000-4000-8000-000000000168",
        "valid_time": "2026-08-30T10:48:00Z",
        "input_uri": "s3://rainpulse/analysis/fuzhou/2026/08/30/1048/analysis.zarr",
        "input_sha256": "bbbbbbbbbbbbbbbbbbbbbbbbbbbbbbbbbbbbbbbbbbbbbbbbbbbbbbbbbbbbbbbb"
      },
      {
        "analysis_id": "00000000-0000-4000-8000-000000000174",
        "valid_time": "2026-08-30T10:54:00Z",
        "input_uri": "s3://rainpulse/analysis/fuzhou/2026/08/30/1054/analysis.zarr",
        "input_sha256": "bbbbbbbbbbbbbbbbbbbbbbbbbbbbbbbbbbbbbbbbbbbbbbbbbbbbbbbbbbbbbbbb"
      },
      {
        "analysis_id": "00000000-0000-4000-8000-000000000180",
        "valid_time": "2026-08-30T11:00:00Z",
        "input_uri": "s3://rainpulse/analysis/fuzhou/2026/08/30/1100/analysis.zarr",
        "input_sha256": "bbbbbbbbbbbbbbbbbbbbbbbbbbbbbbbbbbbbbbbbbbbbbbbbbbbbbbbbbbbbbbbb"
      }
    ],
    "output_prefix": "s3://rainpulse/verification/dc2d64bd-cf78-4d74-ad6b-b34716ba098c/rp031-operational-deterministic-v1/",
    "issue_time": "2026-08-30T08:00:00Z",
    "grid_id": "fuzhou_118_123_25_27_0p01deg_v1",
    "model_id": "pysteps-lk",
    "model_version": "pysteps-lk-1.1.0",
    "forecast_contract_version": "1.1",